topicId,words..
1,eating afternoon lovely find brewer ka organic natproductsshow qxtjudfb final
2,tinymaddie lying chef scottish varieties qwj year nicolepilcher cc historic
3,http laurentperrier tonight fab cuissonlondon nbex activities plate nyc ann
4,https lunchtime local btblade gbchefs tz zleversedge immersive heroes wine
5,everymancinema hotel food tea spend sustainable author minded sustainably super
6,read supplemental kmggm celebritycruise adventure boutique team forward vb game
7,http alektcnoa oqmtniiisg made favourite culinary news ra wjkv amazing
8,round recipe wvc indulge bohonews open brewdog cadburyuk ejiofor tasting
9,edible vitafoodseurope rocketandsquash domdexvxpc duffy littlefishfilms dorf vids won coffee
10,silverscreencuisine amp friday cuissonlondon answers hunt sofa gcsn dream carol
